S.No,Title,URL,Score,Created_At,Num_Comments,Top_Comments,Subreddit,Post_ID
1,"Should ""candles"" be banned?",https://www.reddit.com/r/antimeme/comments/1i7g4j8/should_candles_be_banned/,54,2025-01-22 22:40:20,28,"Please do not report any candles until the poll concludes. Thanks for being a part of our sub, and making your voice heard!|I feel like candles are just shit post and sometimes they’re pretty good. I’m not gonna lie.|Candles sometimes get annoying and ruin subreddits for months. But they are also some of the most fun on a subreddit. BHJ is like now 70% candles, and I still go there pretty frequently.|It's hard for me to say for sure, it feels like those are mostly fine, but those moronic posts where figures have words on them and it's supposed to mbr an antimeme.... Eradicate em.

(I mean things like text saying  ""no fucking way"" and there are 2 figures supposedly having sex and 1 has ""no"" written on em and another has a word ""way""..)|Maybe only allow them on weekends?|I'd say only when they are keep getting added for so long it becomes annoying|I think there needs to be a Limit at some Point Like yeah they're part of culture but weeks of only one Post is annoying|I think candles are really fucking funny, and they shouldn't be outright banned. However, it'd make sense to limit them to an extent. Candles that start from a meme inside the subreddit probably shouldn't be allowed, since that somewhat falls under the ""no reposts"" rule and the humor in it is kind of tied to having seen the first post. Also, if you see a bunch of candles stemming from the same source (even if outside the subreddit), you could probably add those to the [banned repost list](https://www.reddit.com/r/antimeme/comments/u57360/no_more_of_any_of_these_posts_theyre_being/), and extend the rules regarding it to include derivatives of that meme.

Alternatively, you could restrict candles to just the comments of the original post (if it's a post in the subreddit), since that accomplishes A) giving credit to the original creator B) having the source easy to find for others to join in on the candle and C) keeping the ""spammy"" posts in one place off the main feed.|Like most other people are saying, they should be allowed for awhile, but if they're spammed they should be banned.|While i'm 100% for banning literal descriptions of templates which are dead jokes before they're even posted, candles usually stem from one particularly good joke, and often either retain the quality of the original or even add to it.

That being said, once a candle becomes so hot that it starts to light it's own candles and so on and so forth, it becomes inevitable that sooner or later people with no sense of humour will get their hands on the format in an attempt to farm karma. Then the candles that follow become either very cheap reskins of the same joke, or they become so predictable that the subversion od expectations never happens, like with the literal descriptions of memes.

So I think there ought to be a middle ground, where we allow candles to exist but only for a limited amount of time from the posting of the original fire meme. That way we still get the funny shitposts but avoid spam and repetitive karma farming.|I particularly liked the one about the nor-gate, though I think I was the only one haha|I was about to type up some giant comment about why ""candles"" are good but then I voted and saw everyone else voted no. 

I think the people on these subs who report stuff like that are just missing the point of these subs or are lost redditors.|You forgot [Yes way](https://www.reddit.com/r/antimeme/comments/1i4xjz2/yes_way/) I made it then they made candles on my candle, sorry for the late comment.|YAAAAY 

candles are a part of the sub, often creating inside jokes or funny little memory|Candles are jokes like any other meme, I don't think they fit here.|Candles are good until they get out of hand. I think candles need to have a limit of how long ago the flame was posted, so the sub isn't overran by them for too long",antimeme,1i7g4j8
2,Should Literal Descriptions Of Templates Be Banned?,https://www.reddit.com/r/antimeme/comments/1i7g0ho/should_literal_descriptions_of_templates_be_banned/,58,2025-01-22 22:35:49,23,"anti-memes are not just about labeling, we need to get more creative|Depends, if it's just a verbatim description of what's in the meme like the example you showed above, I agree those should probably not be allowed; those really don't take any creativity and aren't really funny (or I suppose anti-funny).

Although, I'm a little worried curtain banning something like this could cause overlap with other actually funny posts. For example, I scrolled for about 10 seconds and found [this post](https://www.reddit.com/r/antimeme/comments/1i79lr0/first_time/?utm_source=share&utm_medium=web3x&utm_name=web3xcss&utm_term=1&utm_content=share_button) which could fall on either side of the rule; it describes what's happening, however does it in a way that's (subjectively) enjoyable. Obviously, you could just not take posts like those down, however with the proposed rule in place you'll likely end up receiving many reports in regards to similar posts, where it's subjective whether they violate the rule or not|Yeah. These are generally uncreative and unfunny.|Some of the most [upvoted posts](https://www.reddit.com/r/antimeme/s/LHSifaku1p) in this sub are just literal descriptions of an image/gif, and they are funny imo|Yes, unless they are making things funny by being unfunny, just literal description are really stupid and worthless.|Limit them, once a description of a template is posted don't allow duplicates.|If someone already made the same description joke before it should get removed. But they should stay because they are funny sometimes.|Sometimes they're funny, but it depends.|Id say it's subjective, depends on the context. Some (like that one) are overused but even some of the top posts on this sub break this rule because they do it originally|What's an anti meme?|Sometimes, they're funny, especially when they're from currently big memes we're used to seeing. Seeing a meme format and thinking ""oh this again?"" and the caption turns out to be just a mundane description of the image of the meme can sometimes hit me like a whiplash and get me to chuckle.|Ban these stupid label memes for the love of god!|They're killing this sub|Please no",antimeme,1i7g0ho
3,Human Resources,https://i.redd.it/kbxo0qpb6tfe1.jpeg,3127,2025-01-29 03:40:38,21,"Idk why, but I find this meme format of antimemes especially funny|Yup, that works|SHE IS SUSAN|u/RepostSleuthBot|Mom said its my time to post the same format again|My bones are hurting…",antimeme,1icdvjr
4,Australia has train,https://i.redd.it/wjgeebrafwfe1.jpeg,269,2025-01-29 14:36:17,4,r/SpeedOfLobsters|A train?,antimeme,1icpraf
5,save the kittens,https://i.redd.it/u0xhk1mzrpfe1.png,19636,2025-01-28 16:15:06,66,"Fuck, i didn't think bout it.
Comrades! Mission off! I repeat, mission off!|https://preview.redd.it/qrv8irsqcqfe1.png?width=360&format=png&auto=webp&s=4364281a2ef2663bd57a11925c9bf42639ba7029|Real|That is true it is bad for kittens|How about chemical warfare?|Now that i think of kittens. Hiroshima nuke feels more sadder|https://preview.redd.it/abunwnfzrqfe1.jpeg?width=640&format=pjpg&auto=webp&s=4d6a7f784ce7a7e7d3e816c51bd72f567c2a46f7|not everyone knows, but for me too|r/oddlyspecific worthy?|Nuclear war might be bad for kittens, but at least we'll finally know which bunker houses the world's stash of catnip.|and/or puppies.|Breaking news: Peace treaties have been established across every country as officials are saying “kitten is cute :3” back to you at the station charles.|no more wars|Seeing pets in warzones is even more heartbreaking.|I‘m a puppy person, so…

![gif](giphy|qwGcDfEAGdJWmuSnwh|downsized)|And what about Atomic Kitten?|Large if true|Is there enough scholarly literature to determine the effect it would have on trout?|I hate war for ts|Dammit who let the dogs out to start the nuclear war",antimeme,1ibyu1v
6,Classic,https://i.redd.it/gug0rkrn9wfe1.jpeg,124,2025-01-29 14:04:41,0,,antimeme,1icpcri
7,Tanks don't usually talk,https://i.redd.it/ti76b9l7nsfe1.jpeg,900,2025-01-29 01:53:30,6,"Usually?|It only speaks german|It is obviously that the action itself of going to the lake and asking said panzer a question triggers a lot of thinking and introspection in oneself. The reason the panzer does not answer, is that the answer was inside you all along.|Sprich",antimeme,1icbamn
8,Can't you see she's busy,https://i.redd.it/ztlcskn1tufe1.png,215,2025-01-29 09:09:48,0,,antimeme,1icku1c
9,Reddit when you have bad internet,https://i.redd.it/sbrk34vahqfe1.png,2797,2025-01-28 18:36:49,38,"Close enough|My reaction

![gif](sbln9uyrwofe1)|Thought I had bad internet again|""How to make an idiot click on an useless image""|Not fully acurate, when you click on a loding image, it turns into a spinning orange circle made out of dots. But that would be impossible unless some clever png trick. Good job tho|""reddit when wifi drops by 1 bar"" would be a better caption|Internet when you have bad reddit|Wait, is this the new loading screen?

I'm being fr because I haven't update my app for 2 years (yes I'm serious, my app's build version is 2023.08) and the loading screen is completely different.|I clicked. Thanks.|Ah ha! I'm on light mode!|That's me when you have bad internet|I'm on light mode rn|I fell for it...|Man I'm not lying when I say thay I waited a second for the meme to load lol.|I thought I left my vpn on again|Sat here for a good 5 minutes before realizing 😭😭😭|My internet died trying to load the image then the animation stopped for it so i spent a solid minute of my life waiting for it to load.......

Why must i be forsaken with bad internet and being an idiot....|Reddit when you have good internet*|Dude 
I legit thought my internet was shit😭|i wiped",antimeme,1ic14fi
10,Does this count?,https://i.redd.it/cxl5rp5whsfe1.png,770,2025-01-29 01:23:50,39,"“Does this count?” Is sort of a popular phrase in this sub, so we can go against it by posting pictures of countertops or the Count, but it’s been done enough that I will add it to the upcoming antimeme graveyard. Posts about countertops or Dracula will be removed going forward.|As a non-native English speaker, I don't get the joke|![gif](giphy|IgBMDZCU5IRUFKGhpy)

HOLD IT! That looks familiar…|It does not|https://preview.redd.it/6uhhwzpessfe1.png?width=994&format=png&auto=webp&s=d76fe3fabeb3de3582b0882c98ca77c8e11e909a

Does this?|You've set the bar.|It doesn't have a brain so no, biggest scam ever >:(|![gif](giphy|TgOOIJcXlQ0h7tGQKX)|Well it *is* a counter... Let that sink in.|No|WHAT?! I need to know|It’s counters|No, but does it read?|Desk|Well yes,  but actually no|No it doesn't, it's a liveless object|Counter? I hardly know her|https://preview.redd.it/wqk6jodehwfe1.png?width=1080&format=png&auto=webp&s=400f3fc24d2b40ff5ab956273e1d3523aad79847

counter strike|What?",antimeme,1icakba
11,Stolen from google 🎖️🎖️,https://i.redd.it/plslr9yp4tfe1.jpeg,397,2025-01-29 03:31:59,2,There's not even a single yellow pixel😭|r/anythingbutmetric,antimeme,1icdo6o
12,It doesn't have curtains,https://i.redd.it/qqm1ccdxbwfe1.png,30,2025-01-29 14:18:53,0,,antimeme,1icpj87
13,impress her,https://i.redd.it/aml36d3y8qfe1.jpeg,1165,2025-01-28 17:50:12,19,"I can’t tell if this is an antimeme or absurdist humour, either way this really made me laugh|In this economy?|I just got the original one from r/memes 1 post before this|Egg|Literally that one time in south africa|You may fascinate a woman by giving her a piece of cheese.|misleading title, that is only one grocery of a pack of a bidozen and a half dozen of eggs.|this rly works|You know what, if I was a real girl I would marry a guy who owns a massive animal farm in Midwest and he very rich and powerful|Shopping can be kinda overwhelming for me, so I'd unironically love this|This year give her English muffins",antimeme,1ic0ayv
14,What a body transformation,https://i.redd.it/5xmekt9e1xfe1.jpeg,14,2025-01-29 16:40:08,1,"I also did a big transformation, but it only lead to fat",antimeme,1icrfd7
15,I believe this also belongs to this sub,https://i.redd.it/4waz3n5xptfe1.jpeg,65,2025-01-29 06:18:28,3,Holy shit I love it|But what's the fourth?,antimeme,1ichfxb
16,This sub wasn't recommended to me and I know what it is about. Don't ask me anything.,https://i.redd.it/mf03cepw7ufe1.jpeg,46,2025-01-29 07:12:22,11,"Got it.|Australian chad|Alrighty then.

https://preview.redd.it/iec3x8fikvfe1.jpeg?width=220&format=pjpg&auto=webp&s=5bef789477679a7de5e8ac9c4bcb822346b6973a

Imma give all y’all upvotes.|👍|If you say so|I will ask you regardless. What is the lore implications of this post to the sub?|Okay|👍🏻|but why?",antimeme,1icijh2
17,does this image look odd?,https://i.redd.it/z5xrfar0htfe1.jpeg,57,2025-01-29 04:40:37,6,This was under an r/lies post about removing the number 7|No the image isn't odd. It's just a normal image of the odd number 7.|I cant even|https://preview.redd.it/mbam57ryztfe1.jpeg?width=1242&format=pjpg&auto=webp&s=c9a507ae253c916b9c096b5078758d8b63dfed13|It looks alright to me. The only thing strange about it is the fact that it isn’t divisible by two.,antimeme,1icf9hi
18,This counts (Desperately trying to avoid graveyard),https://i.redd.it/ohvif6rmkvfe1.jpeg,9,2025-01-29 11:44:24,0,,antimeme,1icngad
19,This absolutely sucks.,https://i.redd.it/v3s1s6l1nsfe1.jpeg,53,2025-01-29 01:52:34,2,"Man, this blows.|Herbert Hoover",antimeme,1icb9ui
20,very cool weird,https://i.redd.it/74oxz1he9kfe1.jpeg,11134,2025-01-27 21:41:52,40,"What a lovely weird, it would wee weird if you replaced the we with we.|weird omg your right!! 😨|my dumbass said ""birwe""?|what a lovely weird it would wee bird if you replaced the we with b|My dumbass was thinking ""wait the Eurasian golden oriole doesn't have a B in it""|https://preview.redd.it/280qty6samfe1.jpeg?width=750&format=pjpg&auto=webp&s=985330e49b95ce582c78509dd5eaaf1d71949590|![gif](giphy|WiVvi66FqT2bpym6R8|downsized)|And then it would be wired if you shift E two letters forward|Technically the truth|Ahhh yes, the yellow-headed welackweird|r/suddenlycommunist|This is the peakest antimeme I’ve seen in the past month|🤯|What a lovely weird it would wee weird if you replaced the we with we|Bird Al|My girlfriend literally could not breathe from laughing too hard after I showed her this... Took several minutes to calm her down and her breathing normal again lmao. I only chuckled at it|Would be infinitely more funny if you replaced all b’s with web|The bird is the word|I feel like this sub is going through a renassiance after a long dark age|golden oriole",antimeme,1ibcrbc
21,"The Meuse (or Maas) River is 950 km long, and it runs through France, Belgium and The Netherlands.",https://i.redd.it/deau2ase5qfe1.jpeg,191,2025-01-28 17:32:23,4,Tanks dont talk|What lake? This is an ocean!,antimeme,1ic005y
22,thank you,https://i.redd.it/yre6miacwpfe1.jpeg,182,2025-01-28 16:39:22,6,I need nothing|I kind of want one|https://preview.redd.it/sz16trhx8qfe1.jpeg?width=437&format=pjpg&auto=webp&s=bf15102fe2bb00e86ab21f0ae76a818e30464bce|nothing will make me happy|Is nothing good?,antimeme,1ibz6tl
23,Those who know,https://i.redd.it/smb4zg4ffmfe1.jpeg,1361,2025-01-28 04:59:10,13,I'VE SEEN THIS POST BEFORE !!|This is like the 3rd time seeing this meme bro|u/repostsleuthbot|Light dark|https://preview.redd.it/gdavz1wcuvfe1.jpeg?width=192&format=pjpg&auto=webp&s=665a8272d4e535d09aedba201c0fcc8eba18367b,antimeme,1ibniqs
24,Please let me out!,https://i.redd.it/rdd18qwgsufe1.jpeg,7,2025-01-29 09:06:33,0,,antimeme,1ickrr7
25,That moment where you die.,https://i.redd.it/ufmhf224nsfe1.jpeg,23,2025-01-29 01:52:58,2,I fell down!|I don't want to die like that,antimeme,1icba6c
26,wildly inappropriate,https://i.redd.it/p2s8in8a4xfe1.jpeg,1,2025-01-29 16:56:21,0,,antimeme,1icrnut
27,Sorry for the low quality of the photo my camera is a bit messed up,https://i.redd.it/1p88s0gh2mfe1.jpeg,779,2025-01-28 03:46:40,4,"Good car|This would be me if the picture was me petting my cat (he, however, doesn't like being pet)|Is it just me or it reminds me of that one video made by that female gremlin about the timeline about this cat image which it took place when there was a nuke coming and there multiple paths like its a visual novel game",antimeme,1ibltrr
28,Does this count?,https://i.redd.it/fruny17fowfe1.jpeg,0,2025-01-29 15:27:26,2,No it calculates,antimeme,1icqf1x
29,He was traumatized,https://i.redd.it/2zr1xoyosife1.gif,6259,2025-01-27 16:46:28,47,"An edgy antimeme, interesting|why are we censoring ISIS and beheading? those arent even swearwords|looks like the perfect r/whenthe|Why did you censor it?|Fuck, this reminds me my father used to show me beheaded videos since I was a kid...|This is the funniest meme I've seen today lmao|Idk man, this is pretty funny, dunno if it’s an anti meme.|This is just a meme|how dare you not censor mute, it offensive to mute people|a beding video? like porn or are we talking threadcount?|Too literal |Very specific|this is the best antimeme I’ve seen in a while|I was so confused for a bit, and then I realized they meant Isis the terrorist group and not the Egyptian Goddess|u/savevideo|So dark! Are you sure you're not from the DC Universe?|Wait, if he can’t hear, how did he see it?|""My mute dad describing what he saw after watching an beding video""|[deleted]",antimeme,1ib69un
30,Two Wolves,https://i.redd.it/lzz41xdnkwfe1.png,2,2025-01-29 15:06:17,0,,antimeme,1icq5c2
31,That is a big finger he got there,https://i.redd.it/bri7vkenakfe1.png,1951,2025-01-27 21:48:51,8,I've seen like 5 other people make this exact joke|Lol!! So good|u/repostsleuthbot,antimeme,1ibcxgt
32,Schrödinger,https://i.redd.it/xvjm30uqtlfe1.jpeg,735,2025-01-28 02:57:40,11,You put the text on the cat's speech balloon so now it looks like the cat is inside the box lying about it being soundproof lol|Fun fact: The Schrodinger's Cat thought experiment was intended to point out the apparent absurdity of the Copenhagen interpretation.|how and why is the cat talking,antimeme,1ibkm6r
33,All of thyme as we know it began here,https://i.redd.it/m4tybgmf8vfe1.png,3,2025-01-29 10:36:01,1,r/countablepixels,antimeme,1icmd22
34,"He's my worst enemy, it makes sense.",https://i.redd.it/e4en88ctdlfe1.png,272,2025-01-28 01:28:46,0,,antimeme,1ibifkx
35,It is indeed a threat to sea life and other life,https://i.redd.it/7rogo7464kfe1.jpeg,417,2025-01-27 21:13:08,12,":(|https://m.youtube.com/watch?v=IglBJ62Sv3Q
Title is a little clickbaity but it’s actually a pretty informative video. Key points being the garbage patch doesn’t look like a floating island of garbage, vast majority is from fishing or big corporations, not little people throwing water bottles in the ocean, and most of it is microplastics.|Why is it called a garbage patch if there's no garbage in it? It's just water saturated with microplastics.|The patch is actually not that dense. It doesn't look like what's in the photo.|or uk for short|That's actually just sad...|I searched on Google Maps and couldn't find it. Lies.|Orange?|[deleted]",antimeme,1ibc2ow
36,Help me,https://i.redd.it/nozexup7fffe1.gif,9426,2025-01-27 05:32:54,57,"r/whenthe|Ugh, I hate it when that happens|I think people are trying to save this video|why are u the only one affected by this?|;fling|u/savevideo|Is it just me or does this feel like a classic case of ""everyone's saving but me""?|[Same story but I'm at the exact north pole:](https://preview.redd.it/7vw536ekwkfe1.jpeg?width=1440&format=pjpg&auto=webp&s=2fccb38234b3954bf7fed756134f91599fd5a0a6)|u/savevideo I'm part of the cool crew now|This my friends is why the ability to stop time wouldn’t be fun. This crap could happen if you’re not careful!|Is it just me or does this happen at the worst times?|u/profanitycounter|u/savevideobot|u/savevideo|u/savevideobot|u/savevideo|u/SaveVideo|u/savevideo|u/savevideo|r/therapistmagic",antimeme,1iaui5a
37,Probably been posted here before,https://i.redd.it/htaiwlzazkfe1.png,206,2025-01-28 00:07:06,8,"Let’s check
u/repostsleuthbot|⠀⢣⠀⠀⢀⣿⠀⠀⢀⠀⣿⡆⠀⠋⠀⠀⣿⣴⣿⠏⠀⠀⢈⡇⡆⢠⢟⢸⣿⣿⣿⣿ ⠸⡆⠣⠀⠸⡇⠀⠀⢸⡆⡜⣷⠀⠀⠀⢠⡙⠉⠀⠀⠀⠀⣾⢧⠁⣼⢸⠘⣿⣿⣿⣿ ⠀⢻⡃⠱⡀⠁⠀⠀⠀⣇⡇⣿⡆⠀⠀⠈⠁⠀⠀⠀⠀⣸⡿⡘⢠⡏⠈⠀⣿⣿⠟⣿ ⠀⠈⢧⠐⠜⢄⠀⠀⠀⠙⣿⠘⣟⠄⠀⠀⠀⠀⠀⠀⣸⠟⣴⠃⣾⠃⣀⠀⣿⢁⢀⣿ ⠀⠀⠀⢇⠈⢄⠀⠀⠀⠀⠘⣇⢹⡄⠀⠀⠠⠀⠀⣰⡏⠀⡏⢰⡿⠀⠁⠸⢡⡎⢸⣿ ⠀⠀⠀⠈⠂⠀⠀⠀⠀⠸⡀⠘⠄⠻⢶⡄⠁⢀⡼⠟⠀⣸⠀⠋⠀⢀⢄⠔⡟⠀⣿⣿ ⠀⠀⠀⠀⠀⠀⠀⠀⢀⠀⠡⢔⡊⠭⠀⡀⠀⢋⣤⠀⢰⠇⠀⣠⠞⡡⠃⡼⠁⢸⣿⣿ ⠀⠀⠀⠀⠐⠀⣠⠞⠋⣴⠖⣡⣞⠉⠀⠀⠀⢹⡏⠀⢀⠀⠛⣥⡞⢁⠎⠀⢀⣿⣿⣿ ⠀⠀⠀⠀⢠⡿⠁⠀⢸⢃⡜⠁⠀⠀⠀⠀⠀⢸⠃⡠⠈⠣⣠⠀⡠⠁⠀⠠⢋⡩⠟⣻ ⠀⠀⠀⠀⠘⠀⠀⠀⠀⠀⠀⠀⠀⣤⣶⡄⠀⠈⠀⠃⠀⠀⣿⠀⠀⢀⣴⠞⠋⢀⣼⣿ ⠀⠀⠀⠀⠀⠀⠀⠀⠀⠀⠀⠀⠘⣿⣿⣿⠀⠀⣠⠀⠀⠠⠋⠀⢰⢋⣠⠞⣡⣿⣿⣿ ⠀⠀⠀⠀⠀⠀⠈⠃⠀⠀⠐⣄⠀⣹⠟⠁⠀⡈⠕⠂⢀⠀⠠⡇⠘⠉⢀⣾⣿⣿⣿⣿ ⠀⠀⠀⠀⠀⠀⠀⠈⠠⠄⠀⠘⢿⡇⠀⡀⠈⠴⢋⣤⠇⢀⡄⠀⠀⠚⢻⣿⣿⣿⣿⣿ ⠀⠀⠀⠀⠀⠀⠀⠀⠀⠀⢤⡄⠀⢀⡀⠀⢀⣠⣴⡟⠀⠠⠴⣶⣾⣿⣿⣿⣿⣿⣿⣿ ⠀⠀⠀⠀⠀⠀⠀⠀⠀⠀⠀⠀⠀⠸⣿⣿⣿⣿⠟⢠⣇⠀⠀⠈⣿⣿⣿⣿⣿⣿⣿⣿ ⠀⠀⠀⠀⠀⠀⠀⠀⠀⠀⠀⠀⠀⠀⣒⣿⠿⠋⢀⣾⣿⢀⡀⠀⠈⠙⣿⣿⣿⣿⡟⠛ ⠀⠀⠀⠀⠀⠀⠀⠀⠀⠀⠀⠀⠀⠀⠋⠁⢀⠀⣼⠋⣿⠀⠙⠷⣄⡀⠈⠉⠉⠀⠀⠀ ⠀⠀⠀⠀⠀⠀⠀⠀⢆⠀⠀⠀⠀⣠⠀⢠⡎⢠⡏⠀⠟⠀⠀⠀⠈⠻⠆⠀⠀⣀⣀⠀ ⠀⠀⠀⠀⠀⠀⠀⠀⠸⡆⠀⠀⠀⠃⠀⠘⠀⣾⠀⠀⠀⠀⠀⠀⠀⠀⠀⠀⠀⣿⣿⡇ ⠀⠀⠠⠤⠤⠴⠶⣶⣶⣭⣄⣀⠀⠀⠀⢀⣈⣫⣤⣤⣤⣤⣤⣄⣀⠀⠀⠀⢸⣿⣿⠁ ⠀⠀⠀⠀⠀⠒⠒⠛⠛⠿⣿⣿⣿⠉⠉⠉⠉⡉⠛⠿⢷⣶⣶⠶⠀⠀⠀⠀⣿⣿⡇⠀ ⠀⠀⠀⠀⠀⠀⠀⠀⠀⠀⠈⠻⣿⠀⠀⠀⠀⠀⠀⠀⠀⠈⠀⠀⠀⠀⠀⢰⣿⣿⠀⣸|Once or twice.|It probably is, so I will add it to the upcoming antimeme graveyard. Thanks for sharing!",antimeme,1ibgel2
38,Sleepy man love quizes,https://i.redd.it/li9l0qxsoife1.png,836,2025-01-27 16:25:16,9,what does the original meme template mean?|I can confirm this is true|It even kinda rhymes|What’s the first question|istg man i love the new mod|Why did I swipe why,antimeme,1ib5vm6
39,Some cow tools would help fix that.,https://i.redd.it/798s83f0xlfe1.jpeg,114,2025-01-28 03:15:58,3,https://preview.redd.it/djeur8tz2mfe1.jpeg?width=219&format=pjpg&auto=webp&s=60bd493b133062abf3f9ed730ed6f5e491810d8e,antimeme,1ibl2ii
40,El Dorado if it was realistic,https://i.redd.it/rsxns93wtlfe1.jpeg,47,2025-01-28 02:58:28,10,"In Nahuatl?

I thought El Dorado would have not been any further up North than Colombia|Actually, this is not accurate because native american languages did not use the Latin Alphabet.|Actual antimeme. Nice. The title undermines the intent though.|Niman axcan mititintlahquia! Timahuiqui ahnozo teyaochihuani?!|El Dorado… doesn’t take place in Peru?",antimeme,1ibkmyi
41,Reginald cornstarch,https://i.redd.it/vpvmxa8lunfe1.jpeg,15,2025-01-28 09:46:00,1,"-It makes you repeat what you hear as a question.   
-It makes me repeat what I hear as a question?    
-Yes",antimeme,1ibtbgu
42,Dad jokes,https://i.redd.it/no6e8bus1gfe1.png,1235,2025-01-27 07:34:21,18,"Oh look, that was me before i learned english|This horse joke is a frequent repost, and will be added to the “no reposts” list shortly. Attempts to post it again in the future will be removed. No offence intended, thank you for contributing to our sub.|This is actualy one of the funniest things I've ever read|u/bot-sleuth-bot repost filter: subreddit",antimeme,1iawyww
43,this is the sign you’ve been looking for,https://i.redd.it/61ozya29ndfe1.jpeg,4242,2025-01-26 23:27:04,7,"YOU are the sign I’ve been looking for 😉|She prevents me from making the goal|haha what a clever twist, a girl who can stop goals is definitely a keeper|But most likely you're a lady because you're a lesbian",antimeme,1ial8z3
44,Edit of a post by u/RealLollam,https://i.redd.it/gjc7z4e61kfe1.png,45,2025-01-27 20:55:54,1,"It's only ""accurate"" if they are independent and having both combines them linearly, I would argue that having both acts more as a multiplier on the feeling on power. The original one was more accurate.",antimeme,1ibbnon
45,Silly Lil' Gamers 😂🤣😂🤣😂🤣,https://i.redd.it/pzp7cuxvdkfe1.png,34,2025-01-27 22:07:53,0,,antimeme,1ibde9i
46,Does this count?,https://i.redd.it/r489uoqfigfe1.jpeg,271,2025-01-27 09:05:22,16,"[No.](https://youtu.be/hUeN6LZNPVQ?si=Ga-aKpdqhetd-7rC)|Ahahah!|Ahahahahah no|He doesn't know how to count nimvers, but when you say about Draculas... He definitely count dracula.|idk if he can|Smash|No, that's an image.|Am I the only one that doesn’t get it?|Hey! That's my Grampa!|Does this Count do what?",antimeme,1iayq1t
47,I'll die anytime soon,https://i.redd.it/adm656dhiife1.jpeg,73,2025-01-27 15:49:12,0,,antimeme,1ib58y3
48,"Yes, that would be incredibly helpful.",https://i.redd.it/14rbcgeg6mfe1.jpeg,6,2025-01-28 04:08:53,0,,antimeme,1ibmcur
49,Typical man,https://i.redd.it/vn8d6fojidfe1.jpeg,916,2025-01-26 23:00:38,5,"Man|I relate to this so much|Nah, whenever I go outside and go back on my pc, within 10 minutes I either forget that I went outside or it feels like that it was yesterday that I went outside",antimeme,1iakjkk
